{
  "schema_version": "1.1.0",
  "vegas_version": "17.x",
  "plugin_list_hash": "sha256:2222222222222222222222222222222222222222222222222222222222222222",
  "transitions": [
    {
      "key": "tr.crossfade-short.a1b2c3",
      "kind": "transition",
      "enabled": true,
      "allowed_contexts": ["topic_boundary"],
      "plugin_unique_id": "{fixture-transition}",
      "is_ofx": true,
      "tags": [
        "soft",
        "dialogue-safe"
      ],
      "params_mode": "params",
      "default_duration_frames": 12,
      "params": {}
    }
  ],
  "video_fx": [
    {
      "key": "vfx.blur.abcdef",
      "kind": "video_fx",
      "enabled": true,
      "plugin_unique_id": "{fixture-video-fx}",
      "is_ofx": true,
      "tags": [
        "soft"
      ],
      "params_mode": "params",
      "params": {
        "amount": 0.2
      }
    }
  ],
  "audio_fx": [
    {
      "key": "afx.compressor.123abc",
      "kind": "audio_fx",
      "enabled": true,
      "plugin_unique_id": "{fixture-audio-fx}",
      "is_ofx": true,
      "tags": [
        "dialogue"
      ],
      "params_mode": "defaults_only"
    }
  ],
  "text_presets": [
    {
      "key": "txt.default.a1b2c3",
      "kind": "text_preset",
      "enabled": true,
      "plugin_unique_id": "{fixture-title}",
      "tags": [
        "subtitle",
        "default"
      ],
      "params_mode": "preset_only",
      "supports_color_override": "unknown",
      "presets": [
        "Default Caption"
      ]
    }
  ],
  "sfx": [
    {
      "key": "sfx.whoosh-01.deaf01",
      "kind": "sfx",
      "enabled": true,
      "path": "assets/sfx/whoosh_01.wav",
      "tags": [
        "whoosh",
        "transition"
      ],
      "params_mode": "defaults_only",
      "duration": 0.6,
      "loudness_lufs": -18.0,
      "license": "CC0",
      "source": "local fixture"
    }
  ]
}
